text,binary_label,language
"Este zumbambico no cuestiona el fraude, cuestiona el como fue que los pillaron 🤦‍♂️ Hagame el Alvaro Uribe favor 🤡💩🐁🐀 No disimulan para que lado es que esta este atolondrado",0,es
"Si ve, no sabe debatir, sino insultar. Por mi puede decir lo que quiera, pero más atolondrado son ustedes que viven en una burbuja.",0,es
" no sabe ese atolondrado que el Estado no hace la guerra .La hacen las organizaciones criminales que atentan contra la sociedad . Y el Estado en cumplimiento de su función constitucional , tiene la obligación de responder a esas agresiones con las Fuerzas Legítimas .",0,es
"Amanecí atolondrado, Juaaassss",0,es
¿ educado o atolondrado ?,0,es
A veces llega nuestro atolondrado existencialismo.” Cuando nos da por cuestionar cada momento d esta fantasía,0,es
Edwin cada vez confirma que es el atolondrado mas grande que a entrado a la casa estudio,0,es
Asi o mas atolondrado mk! Yo no se que putas tengo!,0,es
"El dueño de este Pasquin es como atolondrado ... ojo que anda buscando que lo lean ,no abran esa basura ",0,es
La pelada toda tierni corriendo y esperándolo mientras el man seguía hablando conmigo Uno a esa edad es bien atolondrado.,0,es
Mala hora para ese consejo su mama lo fuera tomado para no tener un hijo tan estúpido y atolondrado,1,es
"Este hombre vive haciendo el ridículo, dónde está lo falso? 😂😂😂 Ah sí en su publicación. No le da ni un poquito de vergüenza señor? Andar quedando como un atolondrado a toda hora, que pena ajena de verdad",0,es
¿Por qué tan lameculos amiga?,1,es
Lameculos,1,es
"Que lameculos los que voten por el mago, no entendieron que los saco a todos no solo en la competencia sino que los manipulo a todos...el verdadero survivor es juan del mar",0,es
"Como no, lameculos",1,es
"Papá no se quien eres, pero déjate de ser lameculos de esa señora, respétate tú mismo. Buen día.",0,es
Asumo con orgullo de clase mi voto por Petro. Pero decir que soy cómplice es un insulto que no permito. COMPLICES los lameculos de todos los delincuentes que han desgobernado el país para enriquecer y mantener el statu que de la rancia oligarquía criolla que se ha robado al pais,0,es
"LAS FUERZAS DEL ESTADO SE CONVIRTIERON EN LOS LAMECULOS DE LOS NARCOTRAFICANTES, POR ESO LOS GENERALES Y COMANDANTEN SALEN CON MANSIONES Y HACIENDAS SIN JUSTFICACIÓN",0,es
Léelo bien Lameculos,1,es
jajaj pobre Lameculos  Baboso!!!,1,es
"Estos hptas lameculos ni para mentirosos sirven los malparidos, poniendo tuis de una cuenta falsa diciendo que es el senador, de tanto lamer culo se les atrofia el cerebro.",0,es
"Viejo sinvergüenza,solo dando noticias mal intencionadas y mentirosas,yo no sé cómo un lameculos como vos llegó a ese puesto",1,es
Esto es noticia en los noticieros lameculos?,0,es
El propio lameculos.,1,es
La diferencia es que uno es tu patrón y vos un lameculos,1,es
Este man si es que no oculta lo LAMECULOS que es.,1,es
parece que a este lameculos mantecoso no le gusta,1,es
jaja mediocreeeeeee lameculos,1,es
"jaja la experta en lameculos dando clases como se debe arrodillar, no le da ni vergüenza a esta tipa, siempre queda en ridículo. ",1,es
jajaja y te haces llamar activista político jajaj compa ni a payaso llegas. hp lameculos descerebrado,1,es
"Calvo payaso, el niño de 45 que llora porque le hacen bullying, ridículo el lameculos del establecimiento",1,es
Habla una lamboba soba chaquetas y lameculos,1,es
Rebuznó un pobre lameculos,1,es
"Pues no vaya, lameculos…",1,es
"Partido de los lameculos. Toda su historia ha sido el más apegado a mamar de la teta del estado. Una partida de leguleyos mediocres con doctorados para robar y vivir del más pendejo. Sus gobiernos dejaron la matanza de las bananeras, el asesinato de Gaitán, el frente nacional…",0,es
Se cayó la geta por qué no habla si no basura pague lo que debe mediocreeeeeee lameculos,0,es
Porque usted es un lameculos oportunista,1,es
Lameculos nivel Dios,1,es
"No. Petro sí sigue con la esencia de su lucha, por eso es presidente y el otro es apenas un lameculos de la clase política tradicional, mafiosa y corrupta.",0,es
falta que diga que Garavito sea el director del icbf aberrantes estos hijueputas lameculos les cuento que no le precluye el proceso al patrón tendrá que pagar ese hp paraco,0,es
"Lameculos malparida, tenes que cuidar la mermelada",1,es
"Vicky, más lameculos que periodista.",1,es
"Los lameculos de las bodegas petristas salen en jauría a defender como sea al inepto descerebrado que los respresenta, aunque sea un imbecil para ellos es un mesías ""nazi""",0,es
Que catre hpta tan aburridor esta gonorrea mierdero . Lameculos petrista,1,es
"Los bodegueros mandando a estudiar y a leer,unos hps que no conocen la historia y mandando a leer,unos lameculos que no saben que pasó en la época en q pablo escobar era el q mandaba,pablo escobar,el mismo que financio al M19 de donde salió el engendro q hoy destruye a Colombia",0,es
"Que susto con ese no pues me voy a esconder, esos lameculos del petrismo dan es risa",0,es
Lameculos cagamisiles vaya q se lo culee un rabino,1,es
Lameculos y usted aprovecha para meter el cuchillo como delincuente que es,1,es
Trafuga vendido lameculos de petro,1,es
Dejar de decir payasadas lameculos,1,es
"Acá se volvió normal. Ahí están Polo Polo, Scaff, Boreal, Nati Bedoya, Jonathan Ferney. Y lo que nos esperan cuando elijan a los Briceño, Portilla y demás lameculos…",0,es
Un guerrillo como usted es que que debería estar en la cárcel o en otro lado lameculos,1,es
"Te pusieron una tarea, desviar la atención de tu amo que va a juicio mientras  el lameculos de Barbosa hace su torcido en la fiscalía y vuelve a pedir preclusion del caso.",0,es
"Rodeenlo ustedes Manada de lameculos impresentables, a los buenos funcionarios como el fiscal Barbosa es que hay que rodear.....Desgraciados corruptos",0,es
Payasa además de lameculos que más hace ?,1,es
"ajjaja alguien q crea el lameculos es la solución, seguramente le falto ácido fólico durante su gestación.",0,es
"No sé necesita salir de Twitter para tener salud mental, tan solo dejar de ver comenté periodistas lameculos , así de sencillo",0,es
"Claro, con semejante lameculos montado por el cerdito, esclavo del sociopata narcoparamilitarasesino de uribe, quieren hacer lo posible por desaparecer las pruebas contra ese hampón…",0,es
"Risa, para no llorar, 🤣🤣🤣 así como saliste como una lok disparada cuando te mostraron tus disfraces. Lameculos",1,es
"Venga, Penélope, ¿Qué se siente ser un lameculos todo el hp día?",1,es
No zombie lameculos hjueputa,1,es
La responsabilidad es del guerrillero y la negra hijueputa y ud lameculos de ellos RESENTIDO HIJUEPUTA,1,es
"Hp digo jp otro polo polo lameculos que llegaron a tan importantes cargos gracias a la ignorancia que reina en el país de ver tanto influencer estúpido e ignorante que habla barrabasadas, por eso los gobiernos no invierten en educar al pueblo lo quieren así estúpido e ignorante",0,es
"Los pogres resentidos, atenidos y mantenidos le cambian el nombre a todo para confundir al populacho, ahora le dicen RACISMO a la CORRUPCIÓN. Estos mamertos lameculos dan risa ... o lástima ?",0,es
"Estos hptas lameculos ni para mentirosos sirven los malparidos, poniendo tuis de una cuenta falsa diciendo que es el senador, de tanto lamer culo se les atrofia el cerebro.",0,es
"No, lo relevante es que los imbéciles lameculos de la derecha, le dan incluso poderes sobrenaturales a su odiado Petro, su fanatismo y estupidez enfermiza los aleja de toda lógica, desean con pasión que el país esté en caos para que sus amos aparezcan como ""salvadores"".",0,es
"Con su lengua, porque de lameculos si que sabe usted.",1,es
"NOOOO lameculos ! Cuanto te pagan por tw, trabaja flojo",1,es
Una vergüenza para este país es que haya tanto sapo petronio como ud. Un desgraciado lameculos de petronio,1,es
"eso no le compete a un alcalde, pelotudo de mierda paramilitar, a ver si por lo menos lees algo de lo que le compete a un alcalde, batracio lameculos",1,es
"Presidente?, que yo sepa el Presidente es Gustavo Petro Urrego. Lambona, lameculos, chupamedias, lustrabotas. A esta burra lo único que le falta es rebuznar y caminar en cuatro patas.",1,es
¿Ser consultor político digital  o bodeguero lameculos de la derecha es un trabajo?,0,es
Se podrá ser más lameculos en esta vida?,0,es
"Difícil precisar cuál de los 4 candidatos es el mas arrogante, y eso sin invitar  Carrasquilla, a Zapateiro, a Duque y a otros tantos lameculos como PoloPolo.",0,es
Esos lameculos petristas no dejan de sorprendernos... Antes decían que los supermercados quebraban a los tenderos de barrio... Y ahora...,0,es
Siii claro mamerta ese cuento solo lo creen los petristas lameculos pero en realidad las personas están más hambrientas y  falta de oportunidades este desgobierno tiene a la gente más necesitada pasando física hambre,0,es
Que se puede esperar de esos HP lameculos chupaguevas lamezuelas servirles del uribismo,0,es
Jajaja estos lameculos chupaguevas lamezuelas servirles del uribismo ciegos brutos e ignorantes critican a Petro por tratar de arreglar el mierdero que dejó Duque pero aplauden todos los robos y atropellos del Uribismo.,0,es
Donde están los tinterillos lameculos qué se regalaban por unos cuantos likes defendiendo bandidos de primera línea para que apoyen la señora y hagan valer sus derechos como persona que fue víctima de malos tratos? Donde estáran?,0,es
Lo más indignante es qué ningún dizque abogado tinterillo lameculos hasta ahora se ha ofrecido para respaldarla y en protesta social se reragalan en cantidades como petateras para defender bandidos de primera línea a cambio de de un par de likes cierto,0,es
"Igual de predecibles a los periodistas lameculos que les ordenan lo que tienen que decir o sino los  tiran. Ustedes son una Vergüenza para el país, en parte son causantes de la gran polarización que hay en Colombia.",0,es
"Juanita así como va, va a terminar como la lameculos de Claudia Gurisatti",0,es
Ese tipejo viene de familia de corruptos 0 votos para ese lameculos,0,es
Jajajaja baia baia ahora hay que meterle la ficha al Bukele alimentado a punta de chontaduro. Un man que es más conocido por ser un Lameculos que por otra cosa. Báilame ese trompo con la uña viejo Miller.,0,es
Vivo en cali y me informo día a día d el que sucede en la ciudad y lo que vivimos es la falta de educación producto de padres malcriando jóvenes que salen a dañar la ciudad. Eso no se soluciona con cárcel como dice el lameculos que habla hasta paisa,0,es
"Vergüenza ajena, pero a ese bodrio de apellido Cabal ya la conocen por su ignorancia supina, su desprecio por los pobres los negros y los indígenas.
El Espectador lameculos más cerca del pasquín El Tiempo,presentando el recorrido bulloso de  la iletrada q aún se refiere la Urss.",0,es
Hasta donde llega el periodismo lameculos q le preocupa q baje el desempleo hp,0,es
"Saquese los pelos de la lengua, lameculos",1,es
"Puro lavaperro, lameculos acompaño en esa  marcha al matarife",0,es
Usted se cayó de la cama cuando era bebé? O porque ese pensamiento que le sale tan del culo? Lameculos,1,es
"Jajajaja seguí de Lameculos y ni ellos te ayudan, por qué son una mentira como vos.",1,es
Que LAMECULOS tan impresentable…,1,es
"Amiga, deja solo a ese payaso si le pagan por hacerte sufrir ya sería millonario",0,es
"Este hpta bobo dice que es lider de un MOVIMIENTO SOCIAL, pero es un payaso!",1,es
Todo un payaso sos,1,es
Yo opino que sos un payaso,1,es
Te dijo la verdad payaso 🤡,1,es
"No se payaso hp, así de desesperado esta malparido",1,es
"jaja payaso, nadie te cree",1,es
"Si no fueras tan chillon y payaso, a lo mejor!",1,es
"Higuita fué un payaso en el arco que le arruinó un mundial a la selección y nunca hizo nada relevante en ella. La selección del pibe, Rincón y Asprilla ganó algunos partiditos y nada mas.",0,es
jajajaja este payaso es tan bruto que se cree sus propias bobadas,1,es
Este payaso hoy se metió todo el bazuco qué pudo.,1,es
El propósito de este payaso es hacer el ridículo y cada vez caer más bajo,1,es
"La payasada bien montada, bueno, ni también hecha, aquí salio el otro payaso 🤡 😂",0,es
PAYASO PEDERASTA!!!,1,es
"Payaso aquel que justifica lo injustificable, Con este Narcogobierno y lo que le hicieron a la niñera !!!",0,es
"Ay deje de ser delicado bobo hpta, vendido te mal pa ri do de 💩, te quiero ver hablando esas mismas chimbadas cuando esa loca cabal hace lo mismo... Payaso hpta",1,es
El ministro es como payaso dice que la sra firmó un consentimiento preguntamos quién no firma un consentimiento bajo presión y en estado de indefensión y temiendo por su vida ?,0,es
"Ay ya sabemos gran malparido que usted es un machista igualito a ese payaso, valientes con las mujeres, y detrás de un teclado, pero con otro hombre son severas cagalastodas bobo hpta",1,es
Payaso quien no firma un consentimiento bajo presión y en esta de indefensión?,0,es
Este payaso va a hacer lo mismo que Chávez. Veremos cómo le sale la vuelta,0,es
"este payaso, si es el propio enemigo de la democracia",0,es
Definitivamente tenemos un payaso en el gobierno,0,es
"Repugnante lo que le hicieron a la chica, denunciar al payaso que se pasó de guache en hacerle eso, eso no es gente normal",0,es
Payaso,1,es
Que les asombra de este PAYASO?,1,es
Tras de payaso mentiroso,1,es
"Bueno, ya entenderás que vos no tenes ninguna autoridad para hablar, sobre ""tener vida propia"" payaso regresate al circo de dónde te saliste. ",0,es
Que Man tan payaso 🤡. Este es de esos típicos bandidos que tiran la piedra y esconden la mano. Este es un cabecilla de la primera línea. Terrorista!!!,1,es
"Y en Cali, en vez de tener orden, autoridad, lo que tenemos es un alcalde payaso 🤡🤡, que le quito autoridad a diferentes entidades, y que la gente falta de cultura hagan lo que quieran. ",0,es
"Si me me dijeran que me van a pagar por decirle a usted baboso, pelmazo, bueno para nada, inepto, mediocre, mentiroso, payaso, le aseguro que diría que no, eso es ganarse la plata muy suave diciendo verdades.",1,es
"Cumpliendo con la agenda que te imponen tus jefes. Cierto, payaso de mierda?",1,es
Q chimba ver como le dan varilla por BRUTO! 😂😂😂 digno representante de la izquierda enchimbada. Jajajaja payaso hijueputa,1,es
Nones relator es un payaso con micrófono,0,es
Baboso vende humo. Nadie te cree payaso!!!,1,es
Que se puede esperar de un payaso como Barbosa. Un completo idiota que encontró su cargo en un paquete de chitos,0,es
Mucho hpta usd se hizo elegir odiando la derecha y a uribe. Ahora lo defiende 🤣🤣 payaso,0,es
Ese Jarlan es un Hijo de Puta payaso! 🤮,1,es
"Payaso y todo, mejor informado que usted, bodeguero.",1,es
"Tenemos a Chucky al frente de la ciudad, un muñeco diabólico payaso y corrupto.",0,es
Un baboso que escribe estupideces y que se ufana de ser un buen payaso.🤡,0,es
El pobre serás vos payaso. No necesito nada de nadie. Pendejo hp.,1,es
"12 años vos con con esa foto de perfil. Habla pues cuándo y dónde o te da culillo, payaso.",1,es
Q bonito ya no les tenemos miedo y lo mejor aún no les creemos payasos setentahptas,0,es
"Así daban a Javier Milei el candidato a la presidencia de Argentina, lo daban de un economista payaso y loco y hoy arrasa todas las encuestas de intención de voto y puede llegar a ser el próximo presidente de Argentina.",0,es
Cómo vas a decir que lleva 3 años arrastrándose si hace dls años te quitó un título y el año pasado estaba metiendo a Tolima en una final? Eres payaso?,0,es
"Usted, que con su reforma laborarlos de 2002, quito los recargos nocturnos, dominicales y de festivos, sin generación de empleo, nos viene a hablar de eso??? No sea tan miserable!  Payaso!",0,es
Si su mamá se lo hubiera tragado usted no existiría pero bueno nada que hacer payaso,1,es
"Ridículo, payaso!",1,es
"Se encontró 3 goles en 7 minutos, payaso.",0,es
Usted espera ser reelegido? Jajajajajajja aaaaa jajajajajajaja esto es un circo 🤡 jajajaja pobre payaso ríe por no llorar.,1,es
Viejo payaso 😂,1,es
Yo hago uno del peor payaso que no hace reír ni a una hiena.,0,es
"A si se pasean los ladrones en Cali bailando como este payaso 🤡, la ciudad en manos de la delincuencia común y este inservible bien gracias!!!",0,es
Esperemos cuando los demanden conque vas a salir payaso.,1,es
"25 de mayo día del payaso .pues  ese  día es de todos,  piensa cuantas veces,tienes el corazón en llanto pero muestras una mueca de risa y tus ojos  muestran gran tristeza ,así que ese día es repetitivo",0,es
se las metió un payaso esos que andan jodiendo con los links de whatsApp?,0,es
El primer tontazo q salió con eso fue el payaso triste de daniel samper,0,es
"Bobo hpta, al equipo que lo hizo grande la B, tiene la misma cantidad de títulos del circo aquel del cual se cree el payaso que más hace reír.",0,es
Asombroso que todo el entorno del payaso es una mierda. Tan raro.,0,es
Payaso hijo de puta,1,es
este payaso da risa comparando un estudio de seguridad con un delito,1,es
Como todo payaso 🤡 🤡 seguidor del hipnotizador de idiotas.,1,es
Payaso hpta el chiste se cuenta solo que cuenta más real malparido bodeguero extranjero.,1,es
jajaja payaso de quinta y tu te convertiste en la bodega más paga de los petroburros,1,es
Paso básicamente porque no estuvieron presentes y ni la chica a hablado.En el momento donde tratas que tú argumento tome más fuerza insultando quedas como payaso,0,es
"claro,  aun no tengo el asterisco como bolsillo de payaso 👀",0,es
Ahora dizque el defensor de los humildes. Payaso arribista!! Sinverguenza,1,es
"40 años de gobierno de derecha y nunca acabaron con nada, ni lograron nada y ahora esperas que alguien lo haga en nueve meses, 🤦 dejé de ser tan payaso, madure a ver si entiende que todos buscamos lo mismo, paz y un país donde se pueda progresar de manera justa.",0,es
"Deje ser payaso, le recuerdo q el pueblo es todo colombia no los 11 mm q votaron por el tal cambio, además de los votos comprados",0,es
Lo de payaso se lo regalo no sea ordinaria. Lo del servicio de Internet y televisión no hay entre la 3 norte y la 2 norte con 44,0,es
"Q pereza caliescali con ese amarillismo siempre se sobre nota el Uribismo, del titular de esta cuenta, siempre en sus publicaciones tirándole al presidente y su primera dama, que de malo tiene ahora q este ruliendose un hueso cuando eso es algo informal y algún payaso la filmó",0,es
"Ade amiga date cuentaaaaa. Ahi no es, alejate de ese payaso no cometas el error de ana plis!!",0,es
"jajaja disque se cayo la confianza en el gobierno, mucho pendejo opinando a lo bien, payaso es que son",0,es
"Periodista ni que nada, ése es un payaso de 40 o 42 o bueno ya debe tener 50.",0,es
"Ese Fico es otro payaso deplorable,inepto,charlatán de plaza.",0,es
Este PAYASO no dice nada bueno pero igual nos hace reír mucho,1,es
"Va a criticar al futbolista con más títulos en la historia del país?, Payaso.",0,es
"Pana le está mostrando HECHOS!!! O sea vos en vez de atacar el argumento atacas el interlocutor, aquí el payaso sos vos que no sos capaz de debatir sino de insultar sin un solo argumento sobre el tema en cuestión.",0,es
Pues andate para allá payaso burro ignorante,1,es
"Jamás, en Cali se quema porque todos sabemos quién es, lo que apoya y que es mentira que un alcalde pueda construir una mega cárcel de la nada. A enredar al duende este payaso.",0,es
"Pero el es un personaje público yo lo sigo , eso no me impide decir que el es un payaso 🤡 que no es imparcial y el sesgo político es evidente , pero sobre todo es un payaso 🤡",0,es
"Jajajaja, el payaso gobierna desde Twitter y desde el balcón, cuando no ebrio, bajo el efecto de otras sustancias o medicamentos.",1,es
Jajajaja ahí esta el payaso terrorista el cambio es un circo de dementes y psicópatas,1,es
INEPTO PAYASO FRACASADO PERDEDOR,1,es
Yo les voy a enseñar a tener presencia en línea sin verse como un completo payaso.,0,es
"el informe dice claramente que ella dudaba pero su novio le dijo que él se los había enviado, lo cuál no era cierto pero por payaso la embarró",0,es
Este tipo es un verdadero payaso 🤡,1,es
Se hace la paja este payaso cada vez que ocurren estas desgracias.,1,es
"No tiene ni idea de comprensión de lectura, mucho menos sabe escuchar... payaso!",1,es
que se puede esperar de Queijeiro igual? es otro payaso mediático más,0,es
"Que gracioso es ver a este imbécil metiendo a la gente pobre para generar alarma, cuando en las imágenes que comparte no se ven mencionados. Los activistas de robledo son bien patéticos y ridículos.",0,es
Mucho imbecil,1,es
"Es un estúpido, a lo mejor la madre es una kilos mortales, imbécil.",1,es
Tenés esa cabeza llena de Mierda,1,es
No podes ser tan imbécil.,1,es
Estoy mamado de tanta gente imbécil,0,es
"Es cierta mi hipótesis, desde Musk tuitero que paga chulo azul es un ímbecil asegurado.",0,es
"Tuitero con bandera de Ucrania, ímbecil asegurado",0,es
"¿Cómo puede ser alguien tan imbécil? Decir que el nazismo es comunismo... Válgame Dios, eso ni un niño de quinto de primaria lo dice.",0,es
Dale Reinaldo rueda no tiene nada de responsabilidad seguí chupandosela por tu club pedazo de imbécil,1,es
Imbécil la diferencia es que en el salvador se arrestan delincuentes a ca se les rinde pleitesía bobalicon.,1,es
Devolvete a primaria imbecil,1,es
"Que tipo más imbecil Barbosa,,la verdad nos merecemos estos satrapas,delincuentes.",0,es
"Que hpta vieja tan bruta, y abogada?, que miedoooo. Esta petrista si es la campeona, jajajaa. Mucha imbecil",1,es
"Uyy, este bobo hp cada vez me deja más perplejo, cada día supera más su grado de imbecil",1,es
Deje su trauma imbécil,1,es
"Eres el unico negro hijueputa, imbécil, tarado, verguenza de la raza, que solo habla mierda, esperando que lo claven los uribistas! ",1,es
"Horacio el tipico machito imbecil que piensa que la mujer debe ir en la cocina, gas de tipo la verdad dios me libre de un hombre como ese en mi vida. Es que no es bueno para nada, ni esposo, ni padre y muchooo menos arquitecto, como que solo es bueno pa robar ",0,es
Me estresan esos hijueputas que viven sufriendo por lo que la gente publica y atención ✨lo sigue✨no es más fácil que dejes de seguir o bloquear pedazo imbecil?,0,es
Que risa q de verdad aquí haya gente tan imbécil.,0,es
"Q fastidio las reacciones de Instagram, que es eso de “😂” ??? ríase bien imbecil",0,es
No sé como existe gente tan recontra imbecil cómo este man jajaj y lo peor es que ya se reprodujo,1,es
"Jajaja pobre imbecil, déjame adivinar, te caíste de la cuna cuando eras bebe y quedaste estupido de por vida?",1,es
Ya dejen de darle fama a este imbecil que literal es lo único que quiere lograr con sus comentarios de mierda. Cada tanto tiene que decir estupideces para que lo noten otras personas aparte de los pubertos raritos que consumen su contenido,0,es
"Uno pensaría que El Tiempo es un medio de comunicación donde uno puede encontrar noticias importantes como las confesiones de mancuso o vainas asi, no semejante estupides de un imbécil que a nadie le interesa",0,es
Usted es un pobre cobarde y un imbécil,1,es
"Por supuesto que el Presidente llama la atención y por supuesto que nos hace hablar de él. Es el tipo de cosa que ocurre cuando tu Presidente es un completo imbécil, un redomado idiota.",0,es
Jajajaja siga soñando calvo imbecil 🙊,1,es
Imbécil.,1,es
Ustedes dijeron que la inversión extranjera se iba a ir del país. Los payasos son ustedes pedazo de imbécil.,1,es
"Que bien lo que hizo el otro vehículo.  Y el imbecil ese se enoja, ahh !!!",0,es
Que pereza tener que seguir aguantando a semejante imbécil. La madre y padre de esta los debieron haber castrado.,1,es
Que imbécil este hptaaaa,1,es
"Jajajaja, que está tomando? Ahora sí se terminó de tostar este imbécil",1,es
Cállate imbécil que nadie te cree una mierda,1,es
A lo bien que sos el propio imbécil…,1,es
"Jajajajaja pobre imbécil, no ha podido comprender que Colombia ya no le come cuento, solo el se cree sus propias mentirás, es hora de que deje de meterse tanta porquería en el coco y piense para donde lleva el país, deje las alucinaciones y ""PIENSE""",0,es
"Si imbécil, que no alcance para el mercado es pura percepción",0,es
"Cuál escándalo imbécil, escándalo lo que viene contando Salvatore Mancuso, la fiscalía, lo de Petro es puro bochinche de la prensa uribista que todavía no pueden aceptar de la derrota",0,es
"Deja de encasillar que no todos serán así,por un imbécil de estos no nos representa como comunidad",0,es
"Pues ya que ella es doble moral etc etc, yo no hago parte de esa mayoria y si dire que West es un imbécil de igual manera la gente que defiende las porquerias que dice el machista, misógino, xenófobo, homofóbico, etc etc... Buenas noches.",0,es
"¿Que espera imbécil? El modelo de la impunidad y permisividad de Colombia, pedazo de hp basura. Sobachaquetas de mierda",1,es
A mi me da es como pena lo imbécil que me vuelvo por alguien,0,es
"Dizque nunca jugó mejor que el rival, lo ven?… es que son hijuputas. La expulsión de cadavid fue en el area del DIm y porque cortó un ataque. Imbecil.",0,es
"Cual violencia? Karma instantáneo, el que nada debe nada teme… cierto? No creo que el cucho tenga ningún problema en comerse el mismo pollo que le dio al perrito sino está envenenado…. O que quiere, que le tire flores a un imbecil como ese?",0,es
Yo si soy la propia imbecil jsjsjsjsjsjsjsjsjs,0,es
Tremendo imbecil.,1,es
No falta la o el imbécil que sale con comentarios nada que ver... Vaya a qué le den !,1,es
Severo imbécil,1,es
Es imposible llegar tan viejo a ser tan imbecil y ruin. Señor usted está rompiendo records,1,es
Que repita la madre que parió semejante imbécil,1,es
