text,binary_label,language
total hermano..... La gente es muy burra.... Con tanto acceso a internet actualmente la gente ya no cree,0,es
"cállate maldita taennie asquerosa, tonta, idiota, imbecil, anormal, estupida, enferma sin cerebro, inepta, pendeja, burra, mensa, retrasada, lerda, ignorante, pedazo de mierda, miserable, decepción de tus padres, bruta huevona, analfabeta, babosa",1,es
"La pobre facha que sueña con reemplazarlo, jajajaja, burra.",1,es
Por favor....callen a esta burra.,1,es
La cerebro de pollo admirando la burra..🤣 Esa fama que tiene de bruta quedó ratificada.,1,es
En pocas palabras esta burra no fue a la escuela,1,es
"Vendiendo humo, el dólar está caro, la inflación disparada y ustedes son unos incapaces que no sacan una burra de un pantano.…",0,es
Entro y pummmmmmm veo q están pidiendo a Gareca 🤦🏻‍♂️ otro ídolo para q la burra menta tóxica lo vuelva mierda.,0,es
"Vieja asquerosa y podrida, incendiaria, soba sacos y lame culos… para hacer lo que hace es porque su vida es una auténtica mierda… burra de arrastre",1,es
"Para nada, que se devuelva para su país o si no, que siga comiendo burra!",0,es
"toda la izquuerda dura, pura, burra, recalcitrante. reunida en un solo sitio, ah y hay terremotos en haití.?? ",0,es
La cara de una chirrete pasada de dosis,1,es
La única chuzada es la de su brazo de la heroína que se mete usted ! CHIRRETE,1,es
La que yo conozco y anda con un chirrete como esposo??,0,es
"Que paso con un caricaturista chirrete que golpea mujeres, dónde estara",0,es
"Esa cara de chirrete, y fijo es bandido como todo petrista. A una chucha así seguro se le cambian de andén. Ya veo porque es resentido y acomplejado.",1,es
Pareces puro chirrete del distrito de aguablanca,1,es
Ni en los peores tiempos de chirrete,0,es
Pinta de chirrete no tiene!!!,0,es
JAJA va uno a ver y se entera que dejaron al man bien por el chirrete que les da maltrato,0,es
Jajajajaja este chirrete hasta oírlo hablar nos dice que es un ignorante y posible consumidor de harina de esa blanca,1,es
Este chirrete no tiene arreglo,1,es
Usted lo que es un pobre bandido con cara de chirrete,1,es
Disque mucha cara de chirrete jaja ojala me hubieran conocido cuando si lo era jaja palabras sobran de ahí pa arriba,0,es
Fastidioso...Este man es un chirrete y huele a orines y sacol,1,es
"la plena me sale equipo de fútbol con todo y suplentes, muchos chirrete lo que son mis panas ",0,es
busco 11 amigos de diferentes signos para ir a meter vicio hoy y ser los chirretes del zodiaco,0,es
"Nadie merece irse del país, ni un campesino, ni un fascista, ni un chirrete.",0,es
"Amigo es el pegante que se mete este hpta, este chirrete antes habla.",1,es
Un día de estos este chirrete con suerte se le desbloquea el cerebro de tanto pagante que le metio,1,es
"El día que la desenmascarando, que desde su vida capitalista tiene engañada a toda esa izquierda que la percibe pobre escribiendo desde un viejo computador. A enredar al duende que cuento tan chirrete!!!",0,es
"Forma tierna de decir, no sea tan chirrete pana!",0,es
Bobo ? Rebobo este chirrete,1,es
"chirrete!!! Pelmazo, nadie te soporta!!",1,es
De dónde salió este chirrete malparido 🤡🤡💩💩,1,es
"No hay cosa más desagradable que escuchar hablar ese chirrete , ahora en televisión cada momento,  propaganda de está cosa , Que pereza  .",0,es
"Que interesante propuesta , nececitamos muchas más de estas , chirrete de mierda ignorante no sabes que decir , es tu único discurso ",1,es
"Necesario, no podemos llevar a la presidencia un chirrete,alcohólico o con cualquier adicción degenerativa ni inmoral",0,es
"Hacé años no escucho esta basura de emisora y por ende esos chirretes,  50 años hablando ",0,es
Hay que ser muy pendejo para creer que Semana no es capaz de manipular lo que sea para hacer el mayor daño posible a Petro.,0,es
"Este negro de mierda, si se la pasa chillando, pendejo.",1,es
"O sea este es de los pendejos que llora cuando alguien dice ""monas chinas"" porque el anime es japonés, no chino. Así de imbécil es",1,es
Jajajaja Pobre PENDEJO. Siga llorando,1,es
"Ome, a lo bien que la Juco tiene puro pendejo posando de 'interprete de las aspiraciones de las masas'. Ahora resulta que si la gente pelea con un horizonte más allá de este gobierno entonces 'le hace el trabajo a la derecha'. Se forman políticamente con la revista Semana.",0,es
"Otra vez ese duelo pendejo de marchas. Trabajen más bien políticos de mierda, dejen de usar al pueblo como títeres.",0,es
El que crea que Santos fue el mejor es un pendejo,0,es
IMPRESENTABLE  es que un medio de comunicación se arrodille al paramilitarismo y ahora te hagas el pendejo como sino fuera contigo,0,es
pendejo útil use el cerebro alguna vez en su vida,1,es
si sos mucho Bobo pendejo,1,es
Traicionas al pueblo por intereses particulares además de pendejo Traidor,1,es
PENDEJO PENDEJO PENDEJO,1,es
"Termine la saga de Moro, me encanto pese a sus defectos. Pero lo mas pendejo fue ver a Goku darle las semillas del ermitaño a Moro (la misma estupidez que hizo con Cell), y tambien revivir a Merus por una justificación bien conveniente.",0,es
Bobo pendejo se va a Autocombatir.,1,es
Y este pendejo en que mundo vive,1,es
"Ya pareces mi papá a cada rato prometiendo cosas que ni va a cumplir, viejo pendejo",1,es
Eso es enfermo pendejo,1,es
"Libertad en Colombia, dice este gran pendejo.",1,es
"Ese es tu problema, yo no ando diciendo si un anime es basura o no, ví capítulos de ese pendejo reencarnado y es aburrida, Kimetsu le vuela mil patadas en la raja a un anime lamentable que sí no me equivoco también tiene novelas ligeras deplorables",0,es
Una cosa es ser paciente y otra es ser pendejo,0,es
"Ojala tuviera un modo inteligente, pero lo mio es ser bien pendejo",0,es
"Venga alvarito, deje de creer que todo el mundo es pendejo, en el pasado le cerraron las puertas a la fiscal de la cpi pero hoy ellos están aquí y saben muy bien que paso en Colombia, tiemble infeliz",0,es
"Jueputa, lo que más me saca la piedra es que todos los días le dan papaya a este pendejo para que se luzca.",1,es
Ahí le hablan pendejo!,1,es
Más pendejo es usted que le cree a petro 🤣,1,es
Papi ¿que pasó aquí? ¿Cuánto le pasaron para que eliminara el tuit y se hiciera el marica? Si lo están amenazando hable pendejo,1,es
Qué pendejo cambia un rolex por un reloj normal?,0,es
me parece muy bien responderle a alguien que solo insulta a lo pendejo,0,es
No falta el pendejo que se crea está noticia FAKE,0,es
"Y es que no mas con el encabezado de su Twitter, uno se da cuenta de lo pendejo que es...Jajajaja. Zooquete. ",1,es
Ya escuchó estos audios? Gran pendejo…,1,es
Hacete el pendejo no más,1,es
Ud cómo es pendejo ahora hablando de estadística?,1,es
"Una vez creí que una fuente hacia milagros y después me di cuenta que es falso y la gente malgastaba su plata por un simple deseo y eso ni pasó, hasta pedí que me dieran plata y luego me quedé como payaso a lo pendejo",0,es
"Yo soy el pendejo que dice cosas todas idiotas (obviamente) y pues aveces si se cagan de la risa, pero no sé si el chistoso atrae a viejas porque por ahora ninguna se me acerca",0,es
pobre hijueputa se tiene fe este pendejo,1,es
resulta que el pendejo este es un enfermo,1,es
"Obvio Petro se va a lavar las manos con lo de Benedetti, ni pendejo que fuera. Se la ha pasado así desde que empezó su gobierno. ",0,es
"Se me jodió el internet (no puedo jugar Warzone) no tengo sueño, ayuden con este jueguito pendejo jajajaja.",0,es
Al menos no eres el pendejo que lo juega en celular.,0,es
"Según este era el presidente , realmente ustedes creen que el pueblo, el verdadero pueblo, es pendejo? Jamás han tenido popularidad para ustedes los medios de comunicación al servicio corruptos, y mucho menos para los políticos que les pagan a ustedes, no somos IMBÉCILES",0,es
Cuando a veces te sientas pendejo recuerda que hay gente asi.,0,es
"Esa fue la que me pasó Ah y porque me quejé en Twitter Lo peor es que algún sapo envío todo eso, y yo sin mencionar nombres ni nada Ah sí, yo por pendejo, ansioso y nervioso no tomé acciones legales",0,es
El viejito pendejo se metió a guionista de El Caballero de los 7 Reinos para poder estar en huelga. Así se va a demorar más en sacar vientos de invierno.,0,es
Este man si es de lo más bocón,1,es
"Finalmente aquí el que está pasando de lo lindo es Ricky, porque es mal líder, mal compañero, bocon y no es que sea la eminencia en pruebas pero como lambonea a todos sigue ahí, el peor.",0,es
"No jodás!! Drogadicto y borracho. Ud. mismo Benedetti es quien se ha desprestigiado!!!  Ambicioso, intolerante, bocón, bufón, engreído, flojo, un payaso!!",1,es
Cómo le cambió el tono desde hoy al cobarde bocón! PUSILÁNIME LAVA PERROS DE TRAQUETOS!!,1,es
Éste Guerrillero no ha dejado d ser el Bocon y Sicario Moral de Siempre.,1,es
" ¿Por qué dicen que Gamma está obsesionada con Byron? Desde antes de salir que dijó que el chaleco iba para Kaboom yo también estoy ofendida, Sería feliz si volviera a salir por bocón ",0,es
La diferencia entre el bocón y el callado,0,es
Ahora al payaso 🤡 este tiene restringido qué en le responde los tuit 🤔 todo bocón es payaso,1,es
Para muestra un bocón!!,1,es
"Tras de cínico, bocón!!!",1,es
amigo tu saliste un poco bocon,1,es
"El que echa gente por que si y por que no, para después andar de bocon diciendo que genera empleo y hay mil vacantes disponibles",0,es
"Malparido bocón ambicioso, borracho de mierda, la esperanza de la gente pobre de este país en peligro porque el HP se emborracho y le dio una pataleta",1,es
"Bocón de mierda, todo un proyecto político en riesgo porque al HP le dió la pataleta por puestos y contratos? Malparido mañoso, torcido.",1,es
"JAJAJAJAJAJA att: el cocalero de Gacha en Madrid jajaja de casualidad llevaste a tu madre a prostituirse también? y en inglés también te puedo enseñar a escribir malparido rolo arrastrado jajajajaja vaya y se acuesta en su banca de ciudad bolivar, bocón de mierda de equipo chico.",1,es
"Cállese payaso bobo hijueputa, populista que coquetea con el fascismo y el paramilitarismo, necesitamos alguien de derecha pero de verdad, no un pelele bocón y arribista como vos.",1,es
"Payaso, bocón e inepto.",1,es
como me gustaria encontrarme a este bocon en la calle ajajajaj,1,es
"Se dice en los sótanos del infierno que, luego de la esperada y más que justa sanción al anciano ladrón y bocón que nos querían poner como presidente, en los próximos días podría venir otra justa decisión ",0,es
"JAJAJA lo que tiene es hambre este hijueputa desnutrido JAJAJAJAJAJA si está en las últimas pida trabajo si quiere yo le doy mijo, en vez de estar todo bocón y malparido dándose las de adinerado cuando no tenes NADA",1,es
"El que se comió el cuento de que tiene alguna credibilidad y nos tiene tramados con su ingenio e inteligencia es el propio fiscal paseador, bocón y derrochador. Debería preocuparse más por dar resultados contra la corrupción en vez de erigirse en defensor gratuito del  genocida.",0,es
Imagino que jack black hará de Bocón,0,es
"Cuál de cristal cacorro bocón, si hablas mierda que querés que te digan pues, paginita hpta esta.",1,es
Que le pongan su tatequieto por Bocón !!,0,es
Por bocón. Es que los Matan.,1,es
Para q sigas de bocón y de sapo.  Deje de meterse en lo q no le importa,1,es
"Cojale dobladillo a esa lengua, bocona",1,es
inescrupuloso Bocón catrehpta… asqueroso,1,es
"Dímelo a mi que tw saca mi lado más peleón y bocon por política, pero fiel creyente y si me nace hablar de Dios lo haré, y también pelearé (y me equivocare), porque un creyente no es mejor que nadie, somos los más defectuosos pero recibimos a Jesús y vamos trabajando internamente",0,es
Pingo y a el otro hijo de ese Viejo HP le metieron un coñazo  ni el más HP por bocón y mal hablado acá en Bucaramanga cuando le digerían por que habían regalado a el país le quedó el ojo apagado completamente,0,es
Cobarde y bocon hijo de puta.,1,es
"Públicamente el fiscalete Barbosa promueve la insubordinación de la policia para lo que constituye una ruptura del estado de derecho mediante un golpe no blando, sino clásico. A este bocón subversivo ¿quién lo ronda? ¿Las cortes tienen algo que decir al respecto?",0,es
"Por estas cosas es que prefiero que no venga ni Gareca ni falcioni ni ningún otro, el hincha es bocón y cambiante, ni con Ramos metimos más de 6 mil abonos, y ni contar que el primer partido de polilla solo fueron 10 mil personas. Déjenlo quieto por allá.",0,es
"A parte se ser disléxico, ciego, tonto, reprimido, bocón, el aborigen ruso, 😂😂 si por el fuera se lavaba con cloro para que le aclare la piel",1,es
El presidente petro debe actuar de inmediato debe denunciar a Benedetti y q pruebe si es verdad lo q dice sino q pague por bocón y por cierto investigar quién le mando esos audios a esta coacla de chismes si fue el mismo Benedetti o fueron chuzados,0,es
"Yo me conozco mucho al hincha, y estoy seguro, pero segurísimo que si Guimaraes en finales pone al segundo portero, acá lo estaban destruyendo. El hincha no es sino bocón.",0,es
"Fuera de recocha, ahí sacrifico al doctor Navia, hay que dejar de ser bocón.",0,es
Buen jugador no todos llegan a su edad jugando a buen nivel pero muy bocon,0,es
Frank si yo te viera en la calle también me darían ganas de voltearte ese máscadero por bocón!,1,es
Si según usted eso es ser bocón la verdad estás demasiado mal,0,es
"Y por eso le respondi d esa forma, el fanatismo politico lo lleva a ser Bocon y valiente atras de una pantalla",0,es
Yo dejaría la nómina cómo está. Me traigo un arquero de categoría y un central argentino bien bocón,0,es
Asprilla depronto el pibe no es sino bocón porque bastante cagón si fue el tipo…,0,es
"Lo único malo es ese Montero Malo, re MALO Se volvió igual de bocón al arquero argentino... Y tapa más una tanga",0,es
"Por otro lado, cuando asuman que Nacional robó a millonarios en la libertadores del 89 ahí hablamos de quién es más bocón.",0,es
No entiendo que tiene de bocón decir que es la segunda casa ? Lo es por que es donde más hinchas de america hay después de Cali en verdad no entiendo que tiene de bocón,0,es
"Y éste se está convirtiendo, tiene el brazo deforme.",1,es
no se como hay gente que le puede parecer linda esta deforme,1,es
"""Jamás tendré un hijo, y tú lo sabes! Nunca seré una gorda deforme, NUN CAA!!""",0,es
Se operan la nariz y les queda deforme.  Ufff.,0,es
Puro bobito defienden al deforme este jajaha,1,es
estoy deforme 🥺🥺🤣🤣🤣 yo si decía que algo no andaba bien en  mi jaja,0,es
asco tu culo deforme,1,es
Pues a mi esta deforme me da náuseas,1,es
"Hey anciano deforme, calcreco, , es mejor no rezar y ser lo que somos , a estar en una catedral dando órdenes de homicidio, desplazamiento y masacres, y eso es usted y el oligarquiamo del cd,",1,es
Sos una deforme  en todo sentido.,1,es
"Ahora estoy deforme 🥺🥺🥺, no pos los ánimos al leer esto jajaja 😂😂😂, ando bastante deforme últimamente",0,es
El mundo patas arriba. Esta drogadicta hablando  de alcoholismo  Y la deforme  hablando  de belleza.,1,es
"Aparte que la palabra que utilizas ""deforme"" solo demuestra que estás muy resentida, inconforme contigo misma y que en algún momento te la han dicho y te hicieron lo que describes. 
Hay que sanar las heridas para no ir regando veneno en los otros.",0,es
Tengo la cabeza deforme del golpe tan sapo duro que me pegué hoy jajaja,0,es
Dios mío mi conducto auditivo es deforme o q es lo q pasa??? No se me sostienen los hptas audífonos que catastrofeeee,0,es
"No deforme la realidad, no hay un solo economista serio que no lo desmienta a ud.",0,es
Dios que cosas el tiene cara deforme,1,es
Usted no es más down porque la cara no es más deforme.,1,es
El príncipe casi se casaba con otra por “compromiso porque la ayudó” y eso que ya primero había conocido a Ariel y casi se besaban . Q tal q la mujer q la ayudo fuese una deforme y no una bonita pelinegra ? Se hubiese casado? Naaa,0,es
"Tarde te amé mi Dios, hermosura tan antigua y tan nueva, tarde te amé! y tú estabas dentro de mí y yo afuera, y así por de fuera te buscaba; y, deforme como era,
me lanzaba sobre estas cosas que tú creaste",0,es
Alguien que vaya  a ver al deforme..no se le haya torcido el otro lado de la cara del coraje !!,1,es
"jajajaj...pobre deforme,ya no sabe qué hacer",1,es
Jajaja vali madres con lo de la Inteligencia Artificial 😂 o así de deforme estoy ?,0,es
existen algunas personas con el alma bien deforme,0,es
"Bruja, corrupta, atolondrada y mitómana. Cortinas con Ud? Si lo suyo es un libro abierto o mejor prontuario abierto. Una transparente y eterna tragedia Familiar . Corra que se les acaba la Fiscalia portátil ! A trinar a la Belle Italia!!",1,es
Bruja mafiosa y carroñera...tiene pruebas o tambien esta drogada... como ya casi no la pueden sacar se la esta consumiendo para no perderla,1,es
La bruja esta mejor que siga volando y alto para que no se estrelle con la realidad,1,es
Reséntida atrevida rastrera y cobarde que poca cosa es esta bruja tan despreciable,1,es
"Esta bruja asquerosa hablando de vergüenza! Debería darle pena! Compradora de votos, despojadora de tierras y aliada del paramilitarismo! Basura humana!!",1,es
Laura pasó de bruja negrera a princesa guerrera en ocho días. Armando ahora pasará de machista misogeno a alcohólico en rehabilitación.,0,es
"Si linda jejejeje, parece que soy bruja",0,es
"Parece ""chupado e bruja"", es decir equímosis espontáneas",0,es
Ahora sí somos amigos!! Vieja bruja,1,es
A llorar Bruja CINICA!,1,es
¡Bruja!,1,es
"En ud nadie confía , vieja bruja!!!",1,es
jajajaja una escoba más bien para esta bruja,1,es
"Uy, está acusando a la honorable senadora de bruja? Ojo que por menos han desaparecido gente en este país. Mucho más ellos.",0,es
Soy un poquito bruja con mis sueños 💙,0,es
"Desde hoy te llamaré, Bruja,… por qué eso es lo que reflejas.",1,es
Con esa invitación me acordé de la bruja de Hansel y Gretel…,0,es
Cada día das mas lastima bruja,1,es
Shakira cuídate de la bruja de madre de piqué cuida a tu hijos de esa vieja,0,es
"Está bruja cizañera,mala leche,vaya y trabaje,haga algo productivo,",1,es
Cara de bruja,1,es
Si lo dice la bruja trepadora,1,es
Que me lleve la bruja️ que tengas una excelente noche hermosa mujer,0,es
Que porque se molestaba si solo le había dicho bruja. Pues para el momento si le resultaba ofensiva la comparación. Hoy en día para un porcentaje de la población femenina hasta es un halago ser llamadas brujas. Incluyéndome !,0,es
"Por ejemplo: cuando yo era niña, le dije a una vecina bruja. Yo lo dije porque en realidad su cara tenía el aspecto de las personas que nos pintaron en esa época como brujas, lo hice en medio de la inocencia, la sra se ofendió, se quejó con mi mamá",0,es
"Fruko y sus Tesos fueron pioneros en la difusión de la salsa colombiana. En 1970 lanzaron su primer disco llamado ""Tesura"" donde presentaron canciones como 'El vidriero', 'El brujo y la bruja', entre otras. ",0,es
Cállese bruja lesbiana!!!,1,es
Bruja soy,0,es
Yo no disculpo a esta bruja hedionda!,1,es
"esta es una bruja asquerosa, en todo caso, ella tiene más ‘pinta’ de sirvienta!",1,es
"venerea, bruja apestosa y mafiosa.",1,es
"Ves, mi instinto de bruja no fallaba cuando te decía que había algo que no me cuadraba jajajajaja",0,es
"también empeoró en 1er, 2do 3er y 4to trimestres 2022 y empeorará en los 2do, 3er y 4to de 2023. En donde está la noticia?No hay que ser egresado de harvard university ni consultar a una bruja para saber como seguirá la economia mientras el petardo capo de Maduro este en el poder",0,es
lo debieron vender cuando llego la oferta del bruja de Belgica pero en fin esto se veia venir,0,es
"Elisa Donovan es la actriz pelirroja que sale en Sabrina, la bruja adolescente y en Clueless.",0,es
agradézcanme por manifestar porque llevo año y medio avisándoles que iban a venir este año. ya solo falta que se me cumpla el de shakira y me gradúo de bruja,0,es
"Si es bruja deme los números del Baloto ;) me tiene sin cuidado si me cree o no, yo sigo con mi conciencia tranquila de haber votado a conciencia",0,es
"Así es Colombia es muy corrupto, feliz cumple la bruja te ves muy bien y muy bella :)",0,es
"No teníamos una película con nombre tan largo desde Las crónicas de Narnia: el león, la bruja y el ropero.",0,es
" bruja con diarrea, cada vez que te leo me dan ganas de vomitar",1,es
"Trato de no creer en mala suerte, destino o esas cosas que lo predisponen a uno o ilusionan falsamente. Creo que todo funciona aleatoriamente y ya, pero uff! Hay temporadas en las que me pasa tanto que si creo que un día me bañaron en una tina de sal mientras una bruja me orinaba",0,es
"No puede ser que la vicky sea géminis igual que yo, maldita  bruja.",1,es
La princesa de las almas está inspirada en la historia de Rapunzel…con un nuevo giro: una bruja adolescente es entrenada para robar almas y entregárselas a un rey inmorta,0,es
"Pobre bruja la única  neurona que tiene no le da para entender que,  él socio de Pablo Escobar es el que le da BAZUCO para que trine en su defensa",1,es
Usted cállese mamarracho HPTA que  también le llegará la hora!,1,es
"Esta negra da es risa, ignorante mamarracho",1,es
Este mamarracho en 6 meses de gorra del erario público cuántas cirugías lleva ya?,1,es
"increíble cómo se desplomó el dólar el día de hoy, la incertidumbre  desploma la bolsa. Cuánta plata está perdiendo la gente, por culpa de este mamarracho de presidente.",0,es
"Jajajaja ,Hijueputa estafador dando explicaciones tontas, sea serio mamarracho!!",1,es
También tiene la misma afición por el perico . Solo eso explica su delirante defensa al mamarracho presidente.,1,es
Que no quiero borrachos Ni locos de atar Ningún mamarracho Que me haga llorar,0,es
Y un delincuente que incendio un país quemo policías  intrumentalizo muchachos para ser delincuentes SII eres un mamarracho aguevado,1,es
si quiere ser profesor solo tiene que saber que bogota es la capital de Colombia y muchas ganas y listo por eso estamos jodidos cualquier mamarracho cree que sabe más que el que ha estudiado juiciosamente,0,es
Si lo dice esta aguevada así debe ser si quiere ser profesor solo tiene que saber que bogota es la capital de Colombia y muchas ganas y listo por eso estamos jodidos cualquier mamarracho cree que sabe más que el que ha estudiado juiciosamente petroburraaa,1,es
Que desgracia la vida de este mamarracho. Jajajajaja compreses una vida y deje de prostituirse como su mamá jajaj,1,es
"Como dije ayer: la narrativa de ese canal es hacerse el mártir, pero al final son un mamarracho impresentable.",0,es
"Salir a la calle y ver a todos lindos y uno sentirse como un mamarracho es algo que uno enfrenta en la maternidad, pero que cosa tan dura",0,es
"Tarado tan grande, eso pasa cuando te reproduces con tu prima, qué dolor que este mamarracho sea congresista",1,es
"Se dice ""interceptación ilegal"". Chuzadas son las que le pegan a usted mamarracho desteñido. 🤡",1,es
"Hace todo mal santafe Méndez es un mamarracho, cada decisión que toma es peor que la anterior...",0,es
"Ese era el impresentable que casi nos meten como presidente, menos mal que semejante mamarracho, que no solo apoyaron los uribistas, también los tibios, no ganó.",0,es
"Millonarios jugando contra América y los payasos del VAR y en contra del mamarracho de árbitro que nos tocó, si sacamos un empate, nos damos por bien servidos. ",0,es
NO a la actual reforma a la salud. Lo dicen casi de manera unánime los colombianos. Solo los fanáticos del petrismo insisten en el mamarracho estatizante que nos quieren imponer.,0,es
silenciado por mamarracho,1,es
hahaha disque católico el mamarracho este. Seguramente violá niños o algo así.,1,es
Uno pudo pensar que Petro era más inteligente pero lastimosamente se ha empeñado en subirle la espuma al mamarracho que es Barbosa!,0,es
Pobre aquel mamarracho que viva feliz con los trancones de Bogotá,0,es
Jajajaja este inútil guerrillero y mitomano le gusta que trapeen el piso con sus cuatro pelos. Espero la respuesta de Santiago Abascal a este mamarracho cachon.,1,es
Ese mamarracho de presidente es un burro Ladron hasta el grado se robó por que es bien bruto,1,es
Cero gracioso. Horroroso que los servicios médicos se presten para esas payasadas mientras hay gente de verdad que muere esperando una verraca ambulancia.  Me extrañaría 0 que haya sido autorizado por el mamarracho que maneje eso,0,es
"Semejante gamin este mamarracho de Avila, un hablamierda engaña bobos",1,es
"De verdad alguien con sus cabales en su lugar, toma de referente político a tremendo mamarracho? La pobre oposición de este país da mucha lástima. ",0,es
"Éste pobre mamarracho,también tendrá q tragarse lo q dice.",1,es
"Así cómo ésta empleada, me topo seguido con empleados costeños (del Atlántico y Bolivar) porque claramente no todos los costeños tienen éste síndrome, el síndrome del ""vivo vive del bobo"" o también llamado ""Síndrome Cleptocrático del Mamaburra""",0,es
el shadoune mamaburra no existe.,0,es
"A la edad de Viera ya Armani tenía 2 copas libertadores de América, 2 recojas sudamericanas, y había humillado a Viera en todas las finales que lo enfrentó.  Mejor haga silencio y báñese, mamaburra.",1,es
claro que si mamaburra es igual no te estoy insultando por que es la verdad,1,es
Jajajajaja mamaburra marica y sus universos paralelos.,1,es
