text,binary_label,language
"MaEstuardo
: A quien no le gusta Metallica? A todo les gusta.//y a quien no le guste simplemente Peguese Un Tiro porque esta en la mierda",1,es
"Me encanta el sarcasmo de este cliente.,. Me pregunto si así maneja los temas de su vida personal peguese un tiro",0,es
"Con asombro me entero que la parrilla de la tv nacional los días sábado, esta tomada de 2 a 9pm por Cantinflas. péguese un tiro",0,es
Peguese UnTiro si es mas bajito que yo...,0,es
No puede con las de la u y le toca con colegialas  peguese un tiro,0,es
"El pastor que vino a mi Colegio esta semana es TAN estúpido que cree que ""The Beatles"" significa ""Los Buitres"" Peguese Un Tiro",0,es
"Cual es la puta necesidad de decirle bb al novio o novia.. ah.? 
Peguese Un Tiro",0,es
"Un Saludo A Usted que tiene de apodo ""Pupú"", por ser negro Péguese UnTiro",1,es
Las calles están imposibles peguese un tiro,0,es
"Si nada le gusta, si no está feliz con su vida ni conforme con nada, no sufra más!  Péguese Un Tiro y deje de amargar a los demás.",1,es
"Si UD es de los q usa el argumento ""A mi todos me tienen envidia, por eso me odian"" es porque tiene alma de ""Divo"", así q Tirese De Un Puente",0,es
Amo fastidiar lo que no me gusta es cuando se vuelve grosería por no aguantar.... Tirese De Un Puente,0,es
"—La vida ya no es igual sin ti a mí lado, que ganas de morirme.
—ENTONCES VAYA Y TÍRESE DE UN PUENTE MALPARIDA FASTIDIOSA.",1,es
"vianogamarra
 DeLaCalleHum
 and 2 others
Jajajaja señor tirese de un puente por favor. Le haría un favor al país.",1,es
Osea si el doctor le dice tirese de un puente usted lo hace ? No seas aguevao,0,es
"Replying to Fernand90142047 richizuluaga
 and 15 others
No. La física no tiene ideología. Tírese de un puente y me dice si la gravedad funciona",1,es
"Replying to 
padresalvajee
Ñero mejor tirese de un puente",1,es
"En serio que tan inhumano hay que ser para tirar a un perro de un puente.
Mejor tírese usted, nos hace un favor a todos",0,es
"Replying to 
luisoliveros13
Sr. tirese de un puente.",1,es
" zid_benavides vanessavallej0
Entonces tirese de un puente, someterse a una vacuna cuyos efectos adversos de los que nadie se hace responsable es directamente proporcional a lo que le sugiero. Usted lo haría?",0,es
"osodelnorte3
Sabina_Kathita ladamita_txt Tírese de un puente mejor, ahí será más aporte, nefasto",1,es
"POR QUÉ MALTRATAN LOS ANIMALES? SI TIENE TANTA IRA ARRANQUESE LOS OJOS O VAYA TIRESE DE UN PUENTE, PERO NO SE META CON LOS ANIMALES, GRAN HIJUEPUTA MISERABLE",1,es
si le dedican un reggaeton tírese de un puente,0,es
"uno de mis mejores amigos: ""bobo hijueputa lo odio tírese de un puente, si pudiera viajar en el tiempo y ahorcarlo con su propio cordón umbilical lo haría""

yo: será que es pa mi?",0,es
"Hay un muchacho en el puente del terminal de Manizales queriéndose suicidar y lo único que le he oído a la gente es 
"" Está queriendo llamar la atención""
"" Si se hubiera querido matar ya hace ratos se hubiera tirado""
"" Tirese y deje la payasada""
De verdad nos falta tanta empatía",0,es
"No hay ser más despreciable que el que trabaja con pereza y tiene que atender a otra gente ¡Amigo, ceda ese puestico y tírese de un puente!",0,es
"¿Usted es de esos que le dice lo mismo a todas? Uy no marica, tírese de un puente",0,es
"Dijo el profesor ""la vida es para machos, si usted va a estar llorando y sufriendo, tirese de un puente"" y pues si hijueputa, tiene razón, a lucharlaaaaaa.",0,es
"Oiga Lagarto 
Váyase a la mierda y tírese de un puente.",1,es
"Si usted es de esos que responde hasta los ""JAJAJAJA"" déjeme decirle que esta enamorado, busque ayuda. Tírese de un puente o Algo.",0,es
"qué asco contigo maldito inservible ya suicidate en vez de estar publicando en las redes que te quieres morir, cobarde de mierda",1,es
suicidate y grábalo porfis,1,es
Que es esto? Los hombres hablando mal de las mujeres? Criticando?? Suicidate viejona.,1,es
Que pesaaaaar suicidate  mejor,1,es
"Odio el maldito transporte público de mi ciudad, maldita la hora en que volví a esta mierda, cómo es posible que salga de casa a las 4:40 de la mañana y a esta hora este a medio viaje. Maldita sea.",0,es
"Tú estás peor, tu vida no vale nada, suicidate.",1,es
TU PUTA MADRE SI TANTO TE QUIERES MORIR SUICIDATE,1,es
"¿Cuál es tu gracia?
- Suicidate",1,es
suicidate perro hijo de puta!!!!  Igual nada se pierde.,1,es
"Deja de quejarte de la maldita vida, si sos tan sufrida, pues suicidate y deja de joder!",1,es
"Me hace un favor?
-Suicidese",1,es
"Me fastidian sus lamentos, suicidese y no joda tanto!!!",1,es
Sí ya pasó 1 año y no a superado al ex mca suicidese!!,0,es
"La vida es como es y punto... asi de simple, si no le gusta suicidese!",0,es
Por tacaña hahahaha un audio de 3 min suicidese jaja,1,es
bueno entonces si todo el mundo está contra ud (hasta WinLiveMsn) suicídese... ja ja ja mentiras,1,es
Pues suicidese entonces,1,es
"Si su felicidad depende de alguien más, suicidese!!",0,es
Le tengo la solución... Suicidese!!!,1,es
suicídese... más aire para respirar jajajaja,1,es
"Si usted es uno de los que le da ""Like"" a sus propias publicaciones de Failbook, suicídese.",0,es
La doble moral me mamá! Suicidese,1,es
Majo: suicidese.,1,es
"""Si usted sigue quedando maluquillo aún con instagram suicidese hermano ...” jajaja q man tan sincero!",0,es
Si esta tan triste suicidese,1,es
Mamita ya es hora de superar el novio de hace como 30 años..... la vida sigue o suicidese,1,es
"Si usted ha votado por santos o uribe y alega porque la salud es un asco,suicidese esa es la salida su patria lo agradecera.",0,es
Que persona tan hipócrita suicidese,1,es
UD SABE QUE UD PARA MI SIEMPRE SERA MI NOVIO ASI QUE SUICIDESE SI QUIERE!,1,es
lo berraco es donde uno se enamore de una persona bajo los efectos del alcohol allí sí suicidese ola,1,es
"Lo más lindo y motivador de la vida es la familia, si usted es muy rudo y no cree eso o no tiene familia así no sea de sangre, suicídese.",1,es
No le gusta vivir??/ Suicidese entonces!!,1,es
colabore con la erradicación de la plaga... suicidese,1,es
"Me salió PUNTAJE NO DISPONIBLE por favor suicidese ,vuelvase ermitaño o mejor dicho deje de intentar ud ya perdió.",1,es
"Suicídese, ¿Ya no se había ido a dormir pues?",1,es
"si usted tambien se ve marica haciendo pucheros como yo, suicidese JAJAJA.",0,es
Si te dicen tenemos que hablar vea suicidese,1,es
"Escriba bien o suicidese, yo le ayudo.",1,es
Pues suicídese y deje de colocar maricadas. :v,1,es
_Posesiva Suicidese ahora jajajajjajaajjajajjaa,1,es
Suicidese es lo mejor para todos.,1,es
SUICIDESE MARICA,1,es
oye pues suicidese que mamera,1,es
Vuélese la tapa de los sesos con una pistola.,1,es
Arrojese calladito y deje de quejarse.,1,es
Asómese a las tasas de desempleo general y juvenil y arrójese por un barranco.,1,es
"Arrojese dl balcón una vez x todas, cómo lo prometio, no sea mentiroso hombre grande",1,es
"Uribe, Colombia lo olvidó.  Cumpla y arrójese al Río Magdalena.",1,es
Lamentablemente este tren no frena. Arrójese si lo desea.,0,es
"Basura marxista. 
Arrojese en el basurero de la Historia.",0,es
Una experiencia recomendable para cualquier mortal es que se tire de una tirolesa...en algunos casos pónganse el seguro...en otros..arrojese sin nada.,0,es
"En la tele acaban de decir ""Ante tormentas eléctricas arrójese en una zanja"", no hay remate.",0,es
arrójese al vacío cuando suene el tono.,1,es
"Si usted es de esos que dicen ""Tabogo"", por favor, arrójese del Salto del Tequendama ahora mismo.",0,es
"""Ame a la mujer más de lo que se merece, arrójese al mar y penetre en lo hondo, pero jamás olvide el salvavidas.""",0,es
"Si está en un vehículo, arrójese al piso de la unidad y busque proteger a los menores, en caso lo acompañen, no salga corriendo de la unidad, puede ser confundido con un criminal escapando de la escena del crimen.",0,es
Si quiere colapsar el sistema vaya y arrójese a las vías del metro en hora pico. Pero deje de decir esta clase de estupideces.,1,es
"Hoy es dia internacional del hombre, si conoce alguno, arrójese a sus brazos, béselo con frenesí, despójelo de sus ropas y hágale el amor.",0,es
"Si usted no tiene humor, arrójese por un barranco.",0,es
"Cuando se cierra una puerta, se abre una ventana. Arrójese por ella",1,es
"Arrójese, pues, la perspectiva liberal al vertedero.",0,es
en caso de incendio arrójese al fuego,1,es
"¿Por qué limitarse con las mano? Queremos compromiso señor, arrójese a la hoguera mejor.",0,es
"En caso de cursilería, arrójese a la escueta racionalidad.",0,es
"Arrójese a un pozo, por favor.",1,es
"Señora Lucía no se tire un tarro con agua y hielo, arrójese a un volcán. ",1,es
"Si escucha tiros, no sea gil y arrojese al suelo. Es lo único que le puede salvar la vida, dado que la oposición se niega a aprobar proyectos, para recuperar seguridad ciudadana.",0,es
"Arrójese a los brazos de la paisa que le diga ""estoy arrecha"" y huya por su vida si una santanderiana le dice ""estoy arrecha mano""",0,es
"Profe usted y sus videos de natación Online mas bien arrojese al  agua y nos enseña!
",0,es
"Si el amor toca a su puerta, arrójese a él, vacío.",0,es
"Si las cosas se enredan, cierre los ojos y arrójese al nudo.",1,es
"Quien esté libre de contradicciones, arrójese la primera piedra por pinche falsx",0,es
Cualquier impulso arrójese en la orilla.,1,es
"Cuando el agua esté a cien grados, retire el recipiente con cuidado, llévelo hasta su rostro y arrójese el líquido caliente en la vista.",1,es
"Señora, por favor, abra una puta ventanilla. Y arrójese. Gracias.",1,es
"Abra el gas de la estufa. Encuentre una buena viga y ahórquese. Puede elegir el método que quiera.
Pero es su mejor oportunidad.",1,es
"No es problemas ,salvo que si al apretar se haya encendido la estufa ,de ser así, abra la llave del gas y presione el encendido de la estufa a ver si prende la tele ,si es así, todo normal",0,es
no perdonan ni la burla. Que abra el gas de su estufa 3 minutos a ver si no apesta!! Nadie sintió el olor a gas??? No creo!,0,es
vamos a hacer una dinámica abra todas las llaves de la estufa y deje que salga el gas por 5 segundos y espere que *de el flamazo*,0,es
Quien dude de la guerra mediática en curso es un analfabeta político.,0,es
Los vi muy felices votando por Francia Márquez no más porque es negrita y activista pero si destituyen a Petro quedamos con una analfabeta de presidente,1,es
"Acabo de leer que ganó la ratera, la analfabeta. Y yo solo puedo decir que ahora si disfrutarán lo votado todos los hediondos que eligieron esa opción",1,es
Es una analfabeta funcional con ínfulas de gran estrella de la comunicación. No tiene decencia ninguna ni moralidad,1,es
"Esto quieres para ti los próximos 6 años, qué una analfabeta y corrupta te gobierne.",0,es
más analfabeta q vos? no creo q haya,1,es
"Dejen de ser tan bestias, que uno puede ser analfabeta pero tener algo de raciocinio.",1,es
"Vagabunda si, analfabeta nunca",0,es
,0,es
Calaña y analfabeta,1,es
"Analfabeta y fascista, es lo que eres.",1,es
Analfabeta funcional,1,es
sono un analfabeta,0,es
"El más antidemócrata de los expresidentes de la era moderna, aparte analfabeta.",1,es
GUSTAVO BOLIVAR. UD ES UN BANDIDO CORRUPTO. BOGOTA NECESITA UN LIDER NO UN LADRÓN.,1,es
"Este bandido que esta al servicio de la banda delicuencial pacto historico es el acosador de periodistas. Alias ""Julian el progre"" 
JulianProgre. Es un Afroamericano que le da vergüenza ser negrø.",1,es
"Ni dudarlo, además quedó claro que nos gobierna un desquiciado que además de bandido, terrorista, comunista es drogadicto.",1,es
CREO QUE FRANCISCO BARBOSA ES UN BANDIDO.,1,es
Lo único que se le da a un bandido…es plomo.,1,es
"Los colombianos ñ, el ejercito y todo el mundo saldrán a la calle hasta que petro se largue.... por que petro es un bandido y producto!!! Y si lo defiendes aun, es que eres pago o bruto!!",1,es
Cuando llegue un bandido retirado a tu vida conocerás lo que es que te quieran bonito.,0,es
"BARBOSA Y SUS CORTINAS DE HUMO....
¿usted es un bandido corrupto está ayudando a narcotraficantes? 
Responda y basta ya de sus cortinas de humo..",1,es
"Sabíamos que no era conveniente para el país que un bandido impune como el, llegase a la presidencia.",1,es
qué difícil es encular a un bandido,0,es
"Definitivamente el que siga siendo petrista después de los audios de Benedetti, o es corrupto y bandido o es un completo enfermo, descerebrado, demente e imbécil!",0,es
"El fiscal es un bandido arrinconado , peligroso",1,es
"Es mejor irse a dormir bajo los efectos de un bareto, que de las palabras de bandido mentiroso 😌",0,es
Se hace el bandido y es un bebé😂,0,es
es un bandido,0,es
Cómo así que el comisionado Danilo Rueda es un “activista del ELN? Hp pero es que no hay ni un solo funcionario de este gobierno que no sea bandido?,1,es
usted es un BANDIDO más....,1,es
"Que JAMÁS se olvide q el Ex-Convicto ⁦
@petrogustavo
⁩ es un Vulgar Bandido.",1,es
"Millones de idiotas útiles que fueron advertidos hasta el cansancio, hoy andan muy arrepentidos (como era de esperarse) de haberle dado el voto al guerrillero asesino, sádico, mitómano y bandido secuestrador comunista del M19. Un agente de la ex KGB, explica qué es ""idiota útil""",1,es
Si usted confía en él es porque efectivamente es un bandido. Jajajaja,1,es
Lula es un bandido típico viejito bonachón engañador .,1,es
"Que tristeza, lastimosamente hay que compartir oxigeno con bestias como tu. Petro es un bandido!! Ustedes apoyaron a un bandido. Simple.",1,es
Dirán que es un bandido o que siendo bandido fue valiente y contó todo salvando el país.  Escoja.,1,es
Lo difícil que es ser un bandido cuando tenés cara de bebe,0,es
"Típico del uribismo: hoy me aborda un muchacho a pedirme una firma que en contra del aborto, y cuando leo la hoja, efectivamente,  era la firma para el referendo que estado impulsando el Uribismo.
El que es bandido, no deja de ser!!!",1,es
Este es un Bandido guerrillero Ojibrotado renuncie miserable por el bien de Colombia y el Mundo.,1,es
se sabe q usted es un mantenido y Bandido,1,es
"Hoy vi criminal minds, entre a la morgue, estuve todo el día con belén y hablé con un bandido, ese es el nivel de multitasking que hice",0,es
"El fiscal Barbosa, como todo un delincuente, incita a las fuerzas armadas a desobedecer al presidente ⁦
petrogustavo
⁩ quien es su comandante supremo. 
El bandido utiliza el cargo para delinquir descaradamente.",1,es
"se hacen las q quieren un bandido un drogadicto y no se q ajajsjs no tienen ni puta idea d lo q es lidiar con ese tipo d situaciones, dejen d romantizar pelotudeces mononeurales d mierda",0,es
"Esta aculillado y muerto del susto. Con la presencia de la Corte Penal Internacional, oficina qué le descubrirá todas sus fechorías y que indudablemente lo pondrán tras las rejas. Todo bandido al verse descubierto, miente. Es un ser ruin",1,es
"Usted es un bandido igual a 
JorgeIvanOspina
 no sé cómo hacen??",1,es
Lo que tenemos de presidente es un bandid,1,es
"el general Oscar ""Coca"" Naranjo es un bandido",1,es
"Todos sabemos q 
petrogustavo
 es un bandido no defienda lo indefendible.",1,es
El bandido corrupto de barbosa es solo un ave de carroña de paso. No se dejen manipular y no violen la privacidad de las personas,1,es
"Ese Leiva que es un bandido,",1,es
Petro es un bandido de la peor calaña. ¿Qué más habrá pasado y que está oculto?,1,es
nunca juegues con una bandida retirada que se está portando bien 🙇🏻‍♀️,1,es
¿Cuántos de ustedes creen que ella es una BANDIDA?,0,es
Sabe que tengo sangre de bandida y todavía se viene a portar mal conmigo,0,es
La más bandida y se sabeeeeee,0,es
Q tal la bandida esa.,1,es
lo bandida no quita lo tierna,0,es
Oh vida bandida,1,es
"ha sido una GRAN temporada de ser bandida, soltera y lokiar, me retiro",0,es
A La bandida de la Cabal solo le creen sus BABOSADAS los borregos del NarcoParaUribismo.,1,es
"La verborrea de una bandida como la Cabello es lo que tiene a la 
@PGN_COL
 sin credibilidad alguna ante el país.",1,es
"muere una enamorada, nace una bandida",0,es
"Esto si es inaceptable por parte de la bandida corrupta 
@mluciaramirez
 y sus alianzas con alias Memo fantasma el aliado de Pablo Escobar.Sinvergüenza.",1,es
La bandida de Marta Lucía Ramírez investigada en Italia,1,es
Yo me quiero hacer la bandida pero la realidad es que tengo un corazón de pollito y fui criada por floricienta. Perdón.,0,es
"Tocó volverme bandida, así les gustan",0,es
me tocó ser bandida ya q la versión de enamorada no me gusta,0,es
"Podría volver a mi vida bandida, pero mi Fátima de ahora no me permite compartirme con cualquiera ni estar en lugares que no quiero solo por no sentirme “sola”, he aprendido mi lección y aprender es avanzar ❤️🫰🏼 nadie nunca me va a quitar mi buen corazón.",0,es
bandida solo la que se deja pillar,0,es
Se ponen todos re cariñosos y yo estoy re bandida!!!! JAJAJAJ,0,es
Eres tan bandida que ya no se si creer en ti.,1,es
uno que quiera formalizar para dejar de ser bandida,0,es
Hoy me dijeron que tenía cara de bandida,0,es
ya te vimos hermana sos re bandida con tus uñas de 5 metros de largo,1,es
"Le fallé a la vida de bandida, siempre termino enamorándome ush",0,es
Bandida como el papá.,1,es
"la incoherencia del guerrillero presidente. tiene el pais en caos, la gasolina exploto.",1,es
"Semejante rata este Canciller Leyva, si lo único q le ha hecho al país es daño.",1,es
Este gobierno petro es de bandidos y narco guerrilleros,1,es
"Muchas Gracias guerrillero 
@petrogustavo
 por mostrarnos su calidad de gabinete nefasto a todos los colombianos; y los mamertos siguen pensando que él tiene el control. Se están sacando los trapos al sol entre los mismos",1,es
"Sería excelente si esto ocurriera, sería el preámbulo de la caída del terrorista 
petrogustavo
",1,es
"El criminal de 
GustavoBolivar
 le ponía cita a Diego y su compañero, después se negaba a salir y les echaba la policía,",1,es
"A la Rata de 
petrogustavo
 lo filman con bolsas de Dinero.

El Hampón de Roy Barreras 
RoyBarreras
 se le olvida Maleta llena de plata.",1,es
"El guerrillero creé que está en campaña, dizque incitando a marchas",1,es
"Un mensaje para el guerrillero de 
@petrogustavo
 Colombia y las instituciones se respetan.",1,es
¿Como calificarías la gestión del Guerrillero Gustavo Petro como presidente de Colombia 🇨🇴?,1,es
"El guerrillero Gustavo Petro, convoca marchas para que respalden sus narco REFORMAS, mientras que los narcoterroristas Farc, obligan a los habitantes a asistir a ellas.Negocio redondo del narcotráfico.",1,es
"Definitivamente Si hay un golpe de estado en este momento contra el Guerrillero 
@petrogustavo",1,es
"Guerrillero, ¿Todo bien en casa?",1,es
Hasta los animales perciben la maldad del guerrillero de Petro!,1,es
"Que vergüenza, que asco y que rabia tener a este esquizofrénico guerrillero 
@petrogustavo
 de Presidente. ",1,es
"Guerrillero 
@petrogustavo
, ya el país sabe que la coherencia no es lo suyo pero si aún le queda algo de vergüenza, le solicito que renuncie a su cargo como presidente de Colombia. Las prácticas (chuzadas) que critico en el pasado, hoy hacen parte de su administración.",1,es
Debe estar triste la comunista María José Pizarro. Háganle llegar esto que me tiene bloqueado ! Ahí están con Monedero y el Guerrillero de Petro,1,es
"El hijo de puta de petro les pagaba para que acabarán con el país, guerrillero hijo de puta.",1,es
"Siglos después, en un giro digno de comedia, el guerrillero desquiciado Gustavo Petro sigue los pasos del demente emperador al nombrar a su amada mula, ""Imeme"", como Ministra de Minas en Colombia.",1,es
"El  guerrillero Gustavo Petro, también fue impuesto por Cuba y todos los bandidos de Colombia.",1,es
"Esta es la guachafita en la que se convirtió el recinto de los padres de la patria. El cantante, un guerrillero de las FARC.
Colombia es un CAOS.",1,es
"Qué circo ese recinto del Congreso es un relajo como el Gbno. Del guerrillero , y tiene el país patas arriba !",1,es
Todo un circo este desgobierno,0,es
"Cuando drogadictos ,guerrilleros y delincuentes están haciendo reformas .Que vergüenza de País",1,es
"La plata de los contribuyentes que se recoge con impuestos se los gastan los 
@SenadoGovCo
 de manera irresponsable",0,es
"El circo de la política en Colombia.  Eso pasa cuando quienes ahí entran son: actores fracasados,terroristas y lagartos....",1,es
"Que lamentable, que triste y que marginalidad lo que le tocó ahora a esa gran nación como Colombia, gente tan honorable y culta a ver dado paso a esta chabacanería",0,es
El circo del comunismo,0,es
"De Petro nada sorprende, es comunista, guerrillero, narco q podemos esperar?",1,es
De modo que el guerrillero decidió sacar a patadas a Laura y al SIMIO del gobierno.,1,es
"La solución no es que salga del gobierno Bebedetti 
 o la “torturadora” 
laurisarabia
 si el Guerrillero exconvito hampón sigue en la presidencia solo se cambiará a los payasos pero no al dueño del circo, ",1,es
"En ésto sale el Guerrillero 
@petrogustavo
 a decir...""no la conozco""",1,es
"Me preocupa el rumbo que está tomando mi país.
Lo veo como un barco dirigido por un pirata guerrillero  lleno de ratas hambrientas devorándose entre ellas.",1,es
"Se acerca un aniversario más del natalicio del guerrillero heroico. Un día marcado por la gloria que supo forjar en su vida de revolucionario internacionalista. #Cuba te adoptó como un hijo más, y aún hoy te benera",0,es
"Este país necesita es un Bukele o un Javier Milei, hay que tumbar al guerrillero.",1,es
"Currículum vitae de 
@petrogustavo
Como ser humano: UNA LACRA
Como guerrillero: UN GENOCIDA
Como político : UN CORRUPTO
Como Alcalde : UN INEPTO
Como administrador: UN FRACASO
Como político: UN EMBAUCADOR 
Como dirigente : UN TERRORISTA",1,es
Un minuto de silencio por bodegueros como tú... Que su vida no tendria sentido si no fuera por el guerrillero.,1,es
"Lo peligroso es que la hija de un guerrillero que perseguía a ciudadanos y magistrados  para extorsionarlos, amenazarlos, incendiarlos, secuestrarlos, asesinarlos,  quemarlos, por “fines políticos” quiera realizar un “revisionismo” de la historia de sangre, destrucción y muerte  que lleva su padre hablando de Hitler, lo cierto es que su papá no es muy diferente a Hitler, dos hombres enfermos mentales a los que no les intereso tomar las armas y usarlas contra todo aquel que no pensara como ellos.",1,es
"¿Quiénes están mamados del gobierno del politiquero y guerrillero 
@petrogustavo
? Sígueme y te sigo. LAS DE DERECHA SOMOS MÁS. Defendamos Colombia 🇨🇴",1,es
"Esto no es casualidad. El guerrillero 
petrogustavo
 se empeñó en atacar la prensa y sembrar odio hacia los Periodistas en sus esbirros. ",1,es
"Según el narco guerrillero ""presidente"", 
@petrogustavo
 , el coronel Dávila se disparó en la ""CIEN"".  ",1,es
Pregunta abierta y objetiva: Usted creé que el Gobierno Guerrillero y corrupto puede mandar asesinar al Fiscal General de la nación  Francisco Barbosa?,1,es
"¿El exconvicto Guerrillero hampón engañabobos de 
petrogustavo
 dio la orden de suicidar al coronel desde su discurso de odio hace 2 días? ",1,es
Benedetti si no lo protege los Estados Unidos le va a pasar lo mismo que el policía de las chuzadas….el guerrillero lo va a mandar a matar.,1,es
"Si Armando Benedetti es inteligente, debería irse para los EEUU y contar todos las porquerías del guerrillero narcoterrorista Gustavo Petro.",1,es
Bukele no se cansa de humillar al borracho empedernido y guerrillero que preside Colombia 👏🏻,1,es
"El guerrillero ex convicto engañabobos petro acepta de manera pública e implícita su responsabilidad en las chuzadas y poligrafos ilegales  del gobierno, ",1,es
"Que vergüenza, que asco y que rabia tener a este esquizofrénico guerrillero 
@petrogustavo
 de Presidente. ",1,es
"Adolescentes del SENA a quienes les levantaron sus tutorías para obligarlos a marchar en favor del guerrillero,  niños llevados a las calles por este gobierno para apoyar sus reformas. ",1,es
"Jajajajaja el Guerrillero hampón 
@petrogustavo
 engañabobos no convocó una marcha, convocó una pequeña izada de bandera",1,es
EX GUERRILLERO REVELA SUPUESTO VINCULO DE MAMELUK0 CON LAS FARC EP 1ERA PARTE,1,es
"Oiga Guerrillero hptx 
petrogustavo
...por acá le hablan  desde las Españas 😅",1,es
Petro es un bandido de la peor calaña. ¿Qué más habrá pasado y que está oculto?,1,es
"Momia, si de drogadictos se trata, ¿Que esperan para apoyar el retiro del guerrillero?",1,es
"El hampón anda desesperado. Niños marchando? Los que no son pagos, son obligados. Típico comportamiento guerrillero",1,es
"Vea pues, entonces el presidente y guerrillero se volvio experto en criminalistica? Esta reemplazando a la Fiscalia General de la Nación? A",1,es
El guerrillero mata vacas le llama errores a los crímenes que cometió el FaMiLioN,1,es
"Están pagando, están pagando, están pagando todo el mal.",0,es
A ti te tienen chuzado pero no el teléfono,0,es
"La verdad es que la administración de Petro, tal y como está funcionando, es dañina para todo el mundo, incluidos los petristas de base. Aunque los mismos no quieran verlo.",0,es
"Sra loca de Tolú ,no es Petro, es Presidente Petro respete a sus superiores.Y respete si quiere que lo respeten, mientras ud siga diciendo guerrillero y usando términos peyorativos para referirse al Presidenre, de loca divo de Tolú no lo bajaremos.",0,es
Yo de usted esperaba h esta historia le falta mucho,0,es
